tvm_benchmark/mixed_precision_models/tuning_logs/resnet50_HWNC_mixed_batch_8.log
{"input": ["cuda", "conv2d_HWNCnc_tensorcore.cuda", [["TENSOR", [58, 58, 8, 64], "uint4"], ["TENSOR", [3, 3, 64, 64], "int4"], [1, 1], [0, 0, 0, 0], [1, 1], "int32"], {}], "config": {"index": 23461335, "code_hash": null, "entity": [["block_row_warps", "ot", 1], ["block_col_warps", "ot", 1], ["warp_row_tiles", "ot", 1], ["warp_col_tiles", "ot", 8], ["chunk", "ot", 1], ["fuse_pack", "ot", 0], ["split_block_k", "ot", 4], ["vector_ws", "ot", 1], ["vector_as", "ot", 1], ["reorder_inner", "re", [0, 1]], ["compute_at_AS", "ot", 1], ["compute_at_WS", "ot", 1], ["AS_double_buffer", "ot", 1], ["WS_double_buffer", "ot", 1], ["auto_unroll_max_step", "ot", 1500]]}, "result": [[6.852849046434494e-05], 0, 2.6267709732055664, 1598164977.3691962], "version": 0.2, "tvm_version": "0.7.dev1"}
{"input": ["cuda", "conv2d_nhwc_tensorcore_im2col.cuda", [["TENSOR", [8, 230, 230, 3], "int8"], ["TENSOR", [7, 7, 64, 3], "int8"], [2, 2], [0, 0, 0, 0], [1, 1], "NHWC", "int32"], {}], "config": {"index": 12630, "code_hash": null, "entity": [["block_row_warps", "ot", 4], ["block_col_warps", "ot", 2], ["warp_row_tiles", "ot", 2], ["warp_col_tiles", "ot", 2], ["chunk", "ot", 16], ["vector_width", "ot", 16], ["fuse_im2col", "ot", 1]]}, "result": [[0.00036789195662650606], 0, 1.693103551864624, 1598160064.8922682], "version": 0.2, "tvm_version": "0.7.dev1"}
{"input": ["cuda", "dense_int8.cuda", [["TENSOR", [8, 2048], "int8"], ["TENSOR", [1000, 2048], "int8"], null, "int32"], {}], "config": {"index": 52049, "code_hash": null, "entity": [["tile_y", "sp", [-1, 1, 8, 1]], ["tile_x", "sp", [-1, 1, 2, 5]], ["tile_k", "sp", [-1, 64]], ["auto_unroll_max_step", "ot", 0]]}, "result": [[1.2870921422523285e-05], 0, 1.6495592594146729, 1597285024.0789788], "version": 0.2, "tvm_version": "0.7.dev1"}
{"input": ["cuda", "conv2d_HWNCnc_tensorcore.cuda", [["TENSOR", [7, 7, 8, 512], "uint4"], ["TENSOR", [1, 1, 2048, 512], "int4"], [1, 1], [0, 0, 0, 0], [1, 1], "int32"], {}], "config": {"index": 10349499, "code_hash": null, "entity": [["block_row_warps", "ot", 1], ["block_col_warps", "ot", 2], ["warp_row_tiles", "ot", 16], ["warp_col_tiles", "ot", 8], ["chunk", "ot", 2], ["fuse_pack", "ot", 1], ["split_block_k", "ot", 2], ["vector_ws", "ot", 1], ["vector_as", "ot", 16], ["reorder_inner", "re", [1, 0]], ["compute_at_AS", "ot", 3], ["compute_at_WS", "ot", 3], ["AS_double_buffer", "ot", 0], ["WS_double_buffer", "ot", 0], ["auto_unroll_max_step", "ot", 512]]}, "result": [[3.5737200398142e-05], 0, 2.301682472229004, 1597282608.6348987], "version": 0.2, "tvm_version": "0.7.dev1"}
{"input": ["cuda", "conv2d_HWNCnc_tensorcore.cuda", [["TENSOR", [9, 9, 8, 512], "uint4"], ["TENSOR", [3, 3, 512, 512], "int4"], [1, 1], [0, 0, 0, 0], [1, 1], "int32"], {}], "config": {"index": 17951121, "code_hash": null, "entity": [["block_row_warps", "ot", 1], ["block_col_warps", "ot", 1], ["warp_row_tiles", "ot", 16], ["warp_col_tiles", "ot", 8], ["chunk", "ot", 4], ["fuse_pack", "ot", 1], ["split_block_k", "ot", 1], ["vector_ws", "ot", 1], ["vector_as", "ot", 1], ["reorder_inner", "re", [1, 0]], ["compute_at_AS", "ot", 2], ["compute_at_WS", "ot", 2], ["AS_double_buffer", "ot", 0], ["WS_double_buffer", "ot", 0], ["auto_unroll_max_step", "ot", 1500]]}, "result": [[7.820361671612265e-05], 0, 2.6768016815185547, 1597281164.2182095], "version": 0.2, "tvm_version": "0.7.dev1"}
{"input": ["cuda", "conv2d_HWNCnc_tensorcore.cuda", [["TENSOR", [7, 7, 8, 2048], "uint4"], ["TENSOR", [1, 1, 512, 2048], "int4"], [1, 1], [0, 0, 0, 0], [1, 1], "int32"], {}], "config": {"index": 7097085, "code_hash": null, "entity": [["block_row_warps", "ot", 1], ["block_col_warps", "ot", 1], ["warp_row_tiles", "ot", 1], ["warp_col_tiles", "ot", 8], ["chunk", "ot", 4], ["fuse_pack", "ot", 1], ["split_block_k", "ot", 1], ["vector_ws", "ot", 8], ["vector_as", "ot", 8], ["reorder_inner", "re", [1, 0]], ["compute_at_AS", "ot", 2], ["compute_at_WS", "ot", 1], ["AS_double_buffer", "ot", 1], ["WS_double_buffer", "ot", 1], ["auto_unroll_max_step", "ot", 0]]}, "result": [[4.1829677683765206e-05], 0, 1.6437132358551025, 1597280199.8695824], "version": 0.2, "tvm_version": "0.7.dev1"}
{"input": ["cuda", "conv2d_HWNCnc_tensorcore.cuda", [["TENSOR", [16, 16, 8, 512], "uint4"], ["TENSOR", [3, 3, 512, 512], "int4"], [2, 2], [0, 0, 0, 0], [1, 1], "int32"], {}], "config": {"index": 12140490, "code_hash": null, "entity": [["block_row_warps", "ot", 1], ["block_col_warps", "ot", 2], ["warp_row_tiles", "ot", 8], ["warp_col_tiles", "ot", 8], ["chunk", "ot", 2], ["fuse_pack", "ot", 1], ["split_block_k", "ot", 1], ["vector_ws", "ot", 1], ["vector_as", "ot", 8], ["reorder_inner", "re", [1, 0]], ["compute_at_AS", "ot", 1], ["compute_at_WS", "ot", 3], ["AS_double_buffer", "ot", 1], ["WS_double_buffer", "ot", 0], ["auto_unroll_max_step", "ot", 512]]}, "result": [[8.585496518987341e-05], 0, 1.7868223190307617, 1597279120.045563], "version": 0.2, "tvm_version": "0.7.dev1"}
{"input": ["cuda", "conv2d_HWNCnc_tensorcore.cuda", [["TENSOR", [14, 14, 8, 1024], "uint4"], ["TENSOR", [1, 1, 512, 1024], "int4"], [1, 1], [0, 0, 0, 0], [1, 1], "int32"], {}], "config": {"index": 18353583, "code_hash": null, "entity": [["block_row_warps", "ot", 1], ["block_col_warps", "ot", 1], ["warp_row_tiles", "ot", 4], ["warp_col_tiles", "ot", 4], ["chunk", "ot", 8], ["fuse_pack", "ot", 0], ["split_block_k", "ot", 4], ["vector_ws", "ot", 8], ["vector_as", "ot", 1], ["reorder_inner", "re", [1, 0]], ["compute_at_AS", "ot", 1], ["compute_at_WS", "ot", 3], ["AS_double_buffer", "ot", 0], ["WS_double_buffer", "ot", 0], ["auto_unroll_max_step", "ot", 1500]]}, "result": [[7.707911588604539e-05], 0, 1.5791685581207275, 1597277600.7648766], "version": 0.2, "tvm_version": "0.7.dev1"}
{"input": ["cuda", "conv2d_HWNCnc_tensorcore.cuda", [["TENSOR", [14, 14, 8, 256], "uint4"], ["TENSOR", [1, 1, 1024, 256], "int4"], [1, 1], [0, 0, 0, 0], [1, 1], "int32"], {}], "config": {"index": 14724621, "code_hash": null, "entity": [["block_row_warps", "ot", 1], ["block_col_warps", "ot", 1], ["warp_row_tiles", "ot", 16], ["warp_col_tiles", "ot", 8], ["chunk", "ot", 4], ["fuse_pack", "ot", 0], ["split_block_k", "ot", 4], ["vector_ws", "ot", 8], ["vector_as", "ot", 1], ["reorder_inner", "re", [1, 0]], ["compute_at_AS", "ot", 1], ["compute_at_WS", "ot", 0], ["AS_double_buffer", "ot", 1], ["WS_double_buffer", "ot", 1], ["auto_unroll_max_step", "ot", 512]]}, "result": [[3.8436940539294765e-05], 0, 1.9319663047790527, 1597275993.9598455], "version": 0.2, "tvm_version": "0.7.dev1"}
{"input": ["cuda", "conv2d_HWNCnc_tensorcore.cuda", [["TENSOR", [30, 30, 8, 256], "uint4"], ["TENSOR", [3, 3, 256, 256], "int4"], [2, 2], [0, 0, 0, 0], [1, 1], "int32"], {}], "config": {"index": 19375602, "code_hash": null, "entity": [["block_row_warps", "ot", 1], ["block_col_warps", "ot", 4], ["warp_row_tiles", "ot", 16], ["warp_col_tiles", "ot", 8], ["chunk", "ot", 2], ["fuse_pack", "ot", 0], ["split_block_k", "ot", 1], ["vector_ws", "ot", 1], ["vector_as", "ot", 1], ["reorder_inner", "re", [1, 0]], ["compute_at_AS", "ot", 1], ["compute_at_WS", "ot", 1], ["AS_double_buffer", "ot", 1], ["WS_double_buffer", "ot", 0], ["auto_unroll_max_step", "ot", 1500]]}, "result": [[7.584285009861933e-05], 0, 10.431355237960815, 1597271964.0190082], "version": 0.2, "tvm_version": "0.7.dev1"}
{"input": ["cuda", "conv2d_HWNCnc_tensorcore.cuda", [["TENSOR", [28, 28, 8, 512], "uint4"], ["TENSOR", [1, 1, 256, 512], "int4"], [1, 1], [0, 0, 0, 0], [1, 1], "int32"], {}], "config": {"index": 23278200, "code_hash": null, "entity": [["block_row_warps", "ot", 1], ["block_col_warps", "ot", 4], ["warp_row_tiles", "ot", 2], ["warp_col_tiles", "ot", 8], ["chunk", "ot", 4], ["fuse_pack", "ot", 0], ["split_block_k", "ot", 4], ["vector_ws", "ot", 8], ["vector_as", "ot", 1], ["reorder_inner", "re", [1, 0]], ["compute_at_AS", "ot", 3], ["compute_at_WS", "ot", 0], ["AS_double_buffer", "ot", 1], ["WS_double_buffer", "ot", 1], ["auto_unroll_max_step", "ot", 1500]]}, "result": [[6.092620718132854e-05], 0, 2.6594135761260986, 1597270229.7414277], "version": 0.2, "tvm_version": "0.7.dev1"}
{"input": ["cuda", "conv2d_HWNCnc_tensorcore.cuda", [["TENSOR", [28, 28, 8, 128], "uint4"], ["TENSOR", [1, 1, 512, 128], "int4"], [1, 1], [0, 0, 0, 0], [1, 1], "int32"], {}], "config": {"index": 18403596, "code_hash": null, "entity": [["block_row_warps", "ot", 1], ["block_col_warps", "ot", 1], ["warp_row_tiles", "ot", 16], ["warp_col_tiles", "ot", 8], ["chunk", "ot", 2], ["fuse_pack", "ot", 0], ["split_block_k", "ot", 1], ["vector_ws", "ot", 1], ["vector_as", "ot", 1], ["reorder_inner", "re", [0, 1]], ["compute_at_AS", "ot", 2], ["compute_at_WS", "ot", 3], ["AS_double_buffer", "ot", 0], ["WS_double_buffer", "ot", 0], ["auto_unroll_max_step", "ot", 1500]]}, "result": [[5.7968033289986996e-05], 0, 1.9137954711914062, 1597268341.3513372], "version": 0.2, "tvm_version": "0.7.dev1"}
{"input": ["cuda", "conv2d_HWNCnc_tensorcore.cuda", [["TENSOR", [30, 30, 8, 128], "uint4"], ["TENSOR", [3, 3, 128, 128], "int4"], [1, 1], [0, 0, 0, 0], [1, 1], "int32"], {}], "config": {"index": 20179455, "code_hash": null, "entity": [["block_row_warps", "ot", 1], ["block_col_warps", "ot", 4], ["warp_row_tiles", "ot", 2], ["warp_col_tiles", "ot", 4], ["chunk", "ot", 4], ["fuse_pack", "ot", 1], ["split_block_k", "ot", 4], ["vector_ws", "ot", 1], ["vector_as", "ot", 8], ["reorder_inner", "re", [1, 0]], ["compute_at_AS", "ot", 3], ["compute_at_WS", "ot", 2], ["AS_double_buffer", "ot", 1], ["WS_double_buffer", "ot", 0], ["auto_unroll_max_step", "ot", 1500]]}, "result": [[6.90106583935018e-05], 0, 2.488347053527832, 1597266760.8799942], "version": 0.2, "tvm_version": "0.7.dev1"}
{"input": ["cuda", "conv2d_HWNCnc_tensorcore.cuda", [["TENSOR", [58, 58, 8, 128], "uint4"], ["TENSOR", [3, 3, 128, 128], "int4"], [2, 2], [0, 0, 0, 0], [1, 1], "int32"], {}], "config": {"index": 18986841, "code_hash": null, "entity": [["block_row_warps", "ot", 1], ["block_col_warps", "ot", 1], ["warp_row_tiles", "ot", 16], ["warp_col_tiles", "ot", 16], ["chunk", "ot", 2], ["fuse_pack", "ot", 0], ["split_block_k", "ot", 1], ["vector_ws", "ot", 1], ["vector_as", "ot", 1], ["reorder_inner", "re", [1, 0]], ["compute_at_AS", "ot", 2], ["compute_at_WS", "ot", 0], ["AS_double_buffer", "ot", 1], ["WS_double_buffer", "ot", 0], ["auto_unroll_max_step", "ot", 1500]]}, "result": [[8.10006155378486e-05], 0, 3.6323509216308594, 1597264098.9308164], "version": 0.2, "tvm_version": "0.7.dev1"}
{"input": ["cuda", "conv2d_HWNCnc_tensorcore.cuda", [["TENSOR", [56, 56, 8, 256], "uint4"], ["TENSOR", [1, 1, 128, 256], "int4"], [1, 1], [0, 0, 0, 0], [1, 1], "int32"], {}], "config": {"index": 10836873, "code_hash": null, "entity": [["block_row_warps", "ot", 1], ["block_col_warps", "ot", 1], ["warp_row_tiles", "ot", 4], ["warp_col_tiles", "ot", 16], ["chunk", "ot", 8], ["fuse_pack", "ot", 0], ["split_block_k", "ot", 4], ["vector_ws", "ot", 8], ["vector_as", "ot", 1], ["reorder_inner", "re", [1, 0]], ["compute_at_AS", "ot", 3], ["compute_at_WS", "ot", 0], ["AS_double_buffer", "ot", 1], ["WS_double_buffer", "ot", 0], ["auto_unroll_max_step", "ot", 512]]}, "result": [[7.545456371134021e-05], 0, 1.9669685363769531, 1597262584.899628], "version": 0.2, "tvm_version": "0.7.dev1"}
{"input": ["cuda", "conv2d_HWNCnc_tensorcore.cuda", [["TENSOR", [56, 56, 8, 256], "uint4"], ["TENSOR", [1, 1, 512, 256], "int4"], [2, 2], [0, 0, 0, 0], [1, 1], "int32"], {}], "config": {"index": 22491609, "code_hash": null, "entity": [["block_row_warps", "ot", 1], ["block_col_warps", "ot", 4], ["warp_row_tiles", "ot", 4], ["warp_col_tiles", "ot", 8], ["chunk", "ot", 4], ["fuse_pack", "ot", 0], ["split_block_k", "ot", 8], ["vector_ws", "ot", 1], ["vector_as", "ot", 1], ["reorder_inner", "re", [1, 0]], ["compute_at_AS", "ot", 1], ["compute_at_WS", "ot", 3], ["AS_double_buffer", "ot", 0], ["WS_double_buffer", "ot", 1], ["auto_unroll_max_step", "ot", 1500]]}, "result": [[6.852445265588914e-05], 0, 2.1143527030944824, 1597254196.7902963], "version": 0.2, "tvm_version": "0.7.dev1"}
{"input": ["cuda", "conv2d_HWNCnc_tensorcore.cuda", [["TENSOR", [28, 28, 8, 512], "uint4"], ["TENSOR", [1, 1, 1024, 512], "int4"], [2, 2], [0, 0, 0, 0], [1, 1], "int32"], {}], "config": {"index": 12132621, "code_hash": null, "entity": [["block_row_warps", "ot", 1], ["block_col_warps", "ot", 1], ["warp_row_tiles", "ot", 16], ["warp_col_tiles", "ot", 8], ["chunk", "ot", 4], ["fuse_pack", "ot", 0], ["split_block_k", "ot", 4], ["vector_ws", "ot", 8], ["vector_as", "ot", 1], ["reorder_inner", "re", [1, 0]], ["compute_at_AS", "ot", 1], ["compute_at_WS", "ot", 3], ["AS_double_buffer", "ot", 1], ["WS_double_buffer", "ot", 0], ["auto_unroll_max_step", "ot", 512]]}, "result": [[6.55554506930693e-05], 0, 1.4146180152893066, 1597252922.3492892], "version": 0.2, "tvm_version": "0.7.dev1"}
{"input": ["cuda", "conv2d_HWNCnc_tensorcore.cuda", [["TENSOR", [14, 14, 8, 1024], "uint4"], ["TENSOR", [1, 1, 2048, 1024], "int4"], [2, 2], [0, 0, 0, 0], [1, 1], "int32"], {}], "config": {"index": 14710266, "code_hash": null, "entity": [["block_row_warps", "ot", 1], ["block_col_warps", "ot", 1], ["warp_row_tiles", "ot", 16], ["warp_col_tiles", "ot", 16], ["chunk", "ot", 4], ["fuse_pack", "ot", 0], ["split_block_k", "ot", 1], ["vector_ws", "ot", 1], ["vector_as", "ot", 1], ["reorder_inner", "re", [1, 0]], ["compute_at_AS", "ot", 1], ["compute_at_WS", "ot", 0], ["AS_double_buffer", "ot", 1], ["WS_double_buffer", "ot", 1], ["auto_unroll_max_step", "ot", 512]]}, "result": [[7.477384770889488e-05], 0, 1.9218440055847168, 1597251388.853041], "version": 0.2, "tvm_version": "0.7.dev1"}
{"input": ["cuda", "conv2d_HWNCnc_tensorcore.cuda", [["TENSOR", [14, 14, 8, 1024], "uint4"], ["TENSOR", [1, 1, 512, 1024], "int4"], [2, 2], [0, 0, 0, 0], [1, 1], "int32"], {}], "config": {"index": 20975265, "code_hash": null, "entity": [["block_row_warps", "ot", 1], ["block_col_warps", "ot", 1], ["warp_row_tiles", "ot", 1], ["warp_col_tiles", "ot", 4], ["chunk", "ot", 8], ["fuse_pack", "ot", 1], ["split_block_k", "ot", 1], ["vector_ws", "ot", 1], ["vector_as", "ot", 16], ["reorder_inner", "re", [1, 0]], ["compute_at_AS", "ot", 1], ["compute_at_WS", "ot", 0], ["AS_double_buffer", "ot", 0], ["WS_double_buffer", "ot", 1], ["auto_unroll_max_step", "ot", 1500]]}, "result": [[3.3352796670880736e-05], 0, 1.7339842319488525, 1597116931.7082293], "version": 0.2, "tvm_version": "0.7.dev1"}
{"input": ["cuda", "conv2d_HWNCnc_tensorcore.cuda", [["TENSOR", [16, 16, 8, 256], "uint4"], ["TENSOR", [3, 3, 256, 256], "int4"], [1, 1], [0, 0, 0, 0], [1, 1], "int32"], {}], "config": {"index": 24067635, "code_hash": null, "entity": [["block_row_warps", "ot", 1], ["block_col_warps", "ot", 4], ["warp_row_tiles", "ot", 2], ["warp_col_tiles", "ot", 2], ["chunk", "ot", 8], ["fuse_pack", "ot", 1], ["split_block_k", "ot", 4], ["vector_ws", "ot", 1], ["vector_as", "ot", 8], ["reorder_inner", "re", [1, 0]], ["compute_at_AS", "ot", 1], ["compute_at_WS", "ot", 2], ["AS_double_buffer", "ot", 1], ["WS_double_buffer", "ot", 1], ["auto_unroll_max_step", "ot", 1500]]}, "result": [[7.454270795180724e-05], 0, 2.7434487342834473, 1597114294.7642243], "version": 0.2, "tvm_version": "0.7.dev1"}
{"input": ["cuda", "conv2d_HWNCnc_tensorcore.cuda", [["TENSOR", [14, 14, 8, 1024], "uint4"], ["TENSOR", [1, 1, 256, 1024], "int4"], [1, 1], [0, 0, 0, 0], [1, 1], "int32"], {}], "config": {"index": 17442441, "code_hash": null, "entity": [["block_row_warps", "ot", 1], ["block_col_warps", "ot", 1], ["warp_row_tiles", "ot", 16], ["warp_col_tiles", "ot", 16], ["chunk", "ot", 2], ["fuse_pack", "ot", 0], ["split_block_k", "ot", 1], ["vector_ws", "ot", 8], ["vector_as", "ot", 1], ["reorder_inner", "re", [1, 0]], ["compute_at_AS", "ot", 2], ["compute_at_WS", "ot", 1], ["AS_double_buffer", "ot", 0], ["WS_double_buffer", "ot", 0], ["auto_unroll_max_step", "ot", 1500]]}, "result": [[3.6509391680299135e-05], 0, 1.8386621475219727, 1597112316.6545196], "version": 0.2, "tvm_version": "0.7.dev1"}
{"input": ["cuda", "conv2d_HWNCnc_tensorcore.cuda", [["TENSOR", [28, 28, 8, 512], "uint4"], ["TENSOR", [1, 1, 256, 512], "int4"], [2, 2], [0, 0, 0, 0], [1, 1], "int32"], {}], "config": {"index": 22230588, "code_hash": null, "entity": [["block_row_warps", "ot", 1], ["block_col_warps", "ot", 2], ["warp_row_tiles", "ot", 1], ["warp_col_tiles", "ot", 8], ["chunk", "ot", 4], ["fuse_pack", "ot", 0], ["split_block_k", "ot", 4], ["vector_ws", "ot", 1], ["vector_as", "ot", 1], ["reorder_inner", "re", [1, 0]], ["compute_at_AS", "ot", 3], ["compute_at_WS", "ot", 2], ["AS_double_buffer", "ot", 0], ["WS_double_buffer", "ot", 1], ["auto_unroll_max_step", "ot", 1500]]}, "result": [[1.76145944808232e-05], 0, 3.0776169300079346, 1597110674.7290645], "version": 0.2, "tvm_version": "0.7.dev1"}
{"input": ["cuda", "conv2d_HWNCnc_tensorcore.cuda", [["TENSOR", [28, 28, 8, 512], "uint4"], ["TENSOR", [1, 1, 128, 512], "int4"], [1, 1], [0, 0, 0, 0], [1, 1], "int32"], {}], "config": {"index": 19118199, "code_hash": null, "entity": [["block_row_warps", "ot", 1], ["block_col_warps", "ot", 2], ["warp_row_tiles", "ot", 16], ["warp_col_tiles", "ot", 8], ["chunk", "ot", 2], ["fuse_pack", "ot", 0], ["split_block_k", "ot", 2], ["vector_ws", "ot", 1], ["vector_as", "ot", 1], ["reorder_inner", "re", [1, 0]], ["compute_at_AS", "ot", 3], ["compute_at_WS", "ot", 0], ["AS_double_buffer", "ot", 1], ["WS_double_buffer", "ot", 0], ["auto_unroll_max_step", "ot", 1500]]}, "result": [[3.579011020677519e-05], 0, 2.809098958969116, 1597106542.114712], "version": 0.2, "tvm_version": "0.7.dev1"}
{"input": ["cuda", "conv2d_HWNCnc_tensorcore.cuda", [["TENSOR", [56, 56, 8, 256], "uint4"], ["TENSOR", [1, 1, 128, 256], "int4"], [2, 2], [0, 0, 0, 0], [1, 1], "int32"], {}], "config": {"index": 18083649, "code_hash": null, "entity": [["block_row_warps", "ot", 1], ["block_col_warps", "ot", 2], ["warp_row_tiles", "ot", 16], ["warp_col_tiles", "ot", 8], ["chunk", "ot", 8], ["fuse_pack", "ot", 0], ["split_block_k", "ot", 4], ["vector_ws", "ot", 1], ["vector_as", "ot", 1], ["reorder_inner", "re", [1, 0]], ["compute_at_AS", "ot", 3], ["compute_at_WS", "ot", 2], ["AS_double_buffer", "ot", 0], ["WS_double_buffer", "ot", 0], ["auto_unroll_max_step", "ot", 1500]]}, "result": [[2.0697588039014372e-05], 0, 2.28279709815979, 1597104627.411465], "version": 0.2, "tvm_version": "0.7.dev1"}
{"input": ["cuda", "conv2d_HWNCnc_tensorcore.cuda", [["TENSOR", [56, 56, 8, 64], "uint4"], ["TENSOR", [1, 1, 256, 64], "int4"], [1, 1], [0, 0, 0, 0], [1, 1], "int32"], {}], "config": {"index": 10497663, "code_hash": null, "entity": [["block_row_warps", "ot", 1], ["block_col_warps", "ot", 1], ["warp_row_tiles", "ot", 4], ["warp_col_tiles", "ot", 2], ["chunk", "ot", 1], ["fuse_pack", "ot", 0], ["split_block_k", "ot", 1], ["vector_ws", "ot", 1], ["vector_as", "ot", 1], ["reorder_inner", "re", [0, 1]], ["compute_at_AS", "ot", 1], ["compute_at_WS", "ot", 0], ["AS_double_buffer", "ot", 1], ["WS_double_buffer", "ot", 0], ["auto_unroll_max_step", "ot", 512]]}, "result": [[0.00011228128501945525], 0, 1.7974693775177002, 1597103410.4687684], "version": 0.2, "tvm_version": "0.7.dev1"}
{"input": ["cuda", "conv2d_HWNCnc_tensorcore.cuda", [["TENSOR", [56, 56, 8, 256], "uint4"], ["TENSOR", [1, 1, 64, 256], "int4"], [1, 1], [0, 0, 0, 0], [1, 1], "int32"], {}], "config": {"index": 18341064, "code_hash": null, "entity": [["block_row_warps", "ot", 1], ["block_col_warps", "ot", 1], ["warp_row_tiles", "ot", 2], ["warp_col_tiles", "ot", 16], ["chunk", "ot", 8], ["fuse_pack", "ot", 0], ["split_block_k", "ot", 2], ["vector_ws", "ot", 1], ["vector_as", "ot", 1], ["reorder_inner", "re", [1, 0]], ["compute_at_AS", "ot", 1], ["compute_at_WS", "ot", 3], ["AS_double_buffer", "ot", 0], ["WS_double_buffer", "ot", 0], ["auto_unroll_max_step", "ot", 1500]]}, "result": [[4.339452490512334e-05], 0, 1.997642993927002, 1597100151.268138], "version": 0.2, "tvm_version": "0.7.dev1"}
{"input": ["cuda", "conv2d_HWNCnc_tensorcore.cuda", [["TENSOR", [56, 56, 8, 64], "uint4"], ["TENSOR", [1, 1, 64, 64], "int4"], [1, 1], [0, 0, 0, 0], [1, 1], "int32"], {}], "config": {"index": 2538081, "code_hash": null, "entity": [["block_row_warps", "ot", 1], ["block_col_warps", "ot", 1], ["warp_row_tiles", "ot", 16], ["warp_col_tiles", "ot", 2], ["chunk", "ot", 1], ["fuse_pack", "ot", 0], ["split_block_k", "ot", 1], ["vector_ws", "ot", 8], ["vector_as", "ot", 1], ["reorder_inner", "re", [1, 0]], ["compute_at_AS", "ot", 3], ["compute_at_WS", "ot", 0], ["AS_double_buffer", "ot", 1], ["WS_double_buffer", "ot", 0], ["auto_unroll_max_step", "ot", 0]]}, "result": [[3.3184064106225014e-05], 0, 1.7981305122375488, 1597099384.1833313], "version": 0.2, "tvm_version": "0.7.dev1"}
{"input": ["cuda", "conv2d_HWNCnc_tensorcore.cuda", [["TENSOR", [7, 7, 8, 512], "int8"], ["TENSOR", [1, 1, 2048, 512], "int8"], [1, 1], [0, 0, 0, 0], [1, 1], "int32"], {}], "config": {"index": 19142805, "code_hash": null, "entity": [["block_row_warps", "ot", 1], ["block_col_warps", "ot", 2], ["warp_row_tiles", "ot", 8], ["warp_col_tiles", "ot", 1], ["chunk", "ot", 8], ["fuse_pack", "ot", 1], ["split_block_k", "ot", 4], ["vector_ws", "ot", 1], ["vector_as", "ot", 8], ["reorder_inner", "re", [1, 0]], ["compute_at_AS", "ot", 3], ["compute_at_WS", "ot", 0], ["AS_double_buffer", "ot", 1], ["WS_double_buffer", "ot", 0], ["auto_unroll_max_step", "ot", 1500]]}, "result": [[6.255421673306773e-05], 0, 1.9827594757080078, 1597248355.7303035], "version": 0.2, "tvm_version": "0.7.dev1"}
{"input": ["cuda", "conv2d_HWNCnc_tensorcore.cuda", [["TENSOR", [9, 9, 8, 512], "int8"], ["TENSOR", [3, 3, 512, 512], "int8"], [1, 1], [0, 0, 0, 0], [1, 1], "int32"], {}], "config": {"index": 7172469, "code_hash": null, "entity": [["block_row_warps", "ot", 1], ["block_col_warps", "ot", 1], ["warp_row_tiles", "ot", 2], ["warp_col_tiles", "ot", 8], ["chunk", "ot", 2], ["fuse_pack", "ot", 1], ["split_block_k", "ot", 1], ["vector_ws", "ot", 1], ["vector_as", "ot", 16], ["reorder_inner", "re", [0, 1]], ["compute_at_AS", "ot", 3], ["compute_at_WS", "ot", 1], ["AS_double_buffer", "ot", 1], ["WS_double_buffer", "ot", 1], ["auto_unroll_max_step", "ot", 0]]}, "result": [[0.00012613476304888154], 0, 1.5542175769805908, 1597246774.7095728], "version": 0.2, "tvm_version": "0.7.dev1"}
{"input": ["cuda", "conv2d_HWNCnc_tensorcore.cuda", [["TENSOR", [7, 7, 8, 2048], "int8"], ["TENSOR", [1, 1, 512, 2048], "int8"], [1, 1], [0, 0, 0, 0], [1, 1], "int32"], {}], "config": {"index": 4062537, "code_hash": null, "entity": [["block_row_warps", "ot", 1], ["block_col_warps", "ot", 1], ["warp_row_tiles", "ot", 8], ["warp_col_tiles", "ot", 8], ["chunk", "ot", 8], ["fuse_pack", "ot", 1], ["split_block_k", "ot", 1], ["vector_ws", "ot", 1], ["vector_as", "ot", 16], ["reorder_inner", "re", [0, 1]], ["compute_at_AS", "ot", 3], ["compute_at_WS", "ot", 3], ["AS_double_buffer", "ot", 1], ["WS_double_buffer", "ot", 0], ["auto_unroll_max_step", "ot", 0]]}, "result": [[6.803742378854626e-05], 0, 1.6553514003753662, 1597244966.7595038], "version": 0.2, "tvm_version": "0.7.dev1"}
{"input": ["cuda", "conv2d_HWNCnc_tensorcore.cuda", [["TENSOR", [16, 16, 8, 512], "int8"], ["TENSOR", [3, 3, 512, 512], "int8"], [2, 2], [0, 0, 0, 0], [1, 1], "int32"], {}], "config": {"index": 9635293, "code_hash": null, "entity": [["block_row_warps", "ot", 2], ["block_col_warps", "ot", 1], ["warp_row_tiles", "ot", 8], ["warp_col_tiles", "ot", 4], ["chunk", "ot", 8], ["fuse_pack", "ot", 1], ["split_block_k", "ot", 1], ["vector_ws", "ot", 1], ["vector_as", "ot", 16], ["reorder_inner", "re", [0, 1]], ["compute_at_AS", "ot", 2], ["compute_at_WS", "ot", 2], ["AS_double_buffer", "ot", 0], ["WS_double_buffer", "ot", 0], ["auto_unroll_max_step", "ot", 512]]}, "result": [[0.00019142662107904642], 0, 2.7781007289886475, 1597242969.7510476], "version": 0.2, "tvm_version": "0.7.dev1"}
{"input": ["cuda", "conv2d_HWNCnc_tensorcore.cuda", [["TENSOR", [14, 14, 8, 1024], "int8"], ["TENSOR", [1, 1, 512, 1024], "int8"], [1, 1], [0, 0, 0, 0], [1, 1], "int32"], {}], "config": {"index": 6524424, "code_hash": null, "entity": [["block_row_warps", "ot", 1], ["block_col_warps", "ot", 1], ["warp_row_tiles", "ot", 2], ["warp_col_tiles", "ot", 4], ["chunk", "ot", 2], ["fuse_pack", "ot", 1], ["split_block_k", "ot", 1], ["vector_ws", "ot", 1], ["vector_as", "ot", 16], ["reorder_inner", "re", [0, 1]], ["compute_at_AS", "ot", 2], ["compute_at_WS", "ot", 0], ["AS_double_buffer", "ot", 1], ["WS_double_buffer", "ot", 1], ["auto_unroll_max_step", "ot", 0]]}, "result": [[0.00015381613056092842], 0, 1.6599528789520264, 1597240930.748147], "version": 0.2, "tvm_version": "0.7.dev1"}
{"input": ["cuda", "conv2d_HWNCnc_tensorcore.cuda", [["TENSOR", [14, 14, 8, 256], "int8"], ["TENSOR", [1, 1, 1024, 256], "int8"], [1, 1], [0, 0, 0, 0], [1, 1], "int32"], {}], "config": {"index": 17589417, "code_hash": null, "entity": [["block_row_warps", "ot", 1], ["block_col_warps", "ot", 4], ["warp_row_tiles", "ot", 16], ["warp_col_tiles", "ot", 1], ["chunk", "ot", 8], ["fuse_pack", "ot", 1], ["split_block_k", "ot", 8], ["vector_ws", "ot", 1], ["vector_as", "ot", 8], ["reorder_inner", "re", [1, 0]], ["compute_at_AS", "ot", 3], ["compute_at_WS", "ot", 1], ["AS_double_buffer", "ot", 0], ["WS_double_buffer", "ot", 0], ["auto_unroll_max_step", "ot", 1500]]}, "result": [[6.60067577383409e-05], 0, 2.0917866230010986, 1597240188.276374], "version": 0.2, "tvm_version": "0.7.dev1"}
{"input": ["cuda", "conv2d_HWNCnc_tensorcore.cuda", [["TENSOR", [16, 16, 8, 256], "int8"], ["TENSOR", [3, 3, 256, 256], "int8"], [1, 1], [0, 0, 0, 0], [1, 1], "int32"], {}], "config": {"index": 1189062, "code_hash": null, "entity": [["block_row_warps", "ot", 1], ["block_col_warps", "ot", 1], ["warp_row_tiles", "ot", 8], ["warp_col_tiles", "ot", 8], ["chunk", "ot", 1], ["fuse_pack", "ot", 1], ["split_block_k", "ot", 1], ["vector_ws", "ot", 1], ["vector_as", "ot", 8], ["reorder_inner", "re", [0, 1]], ["compute_at_AS", "ot", 1], ["compute_at_WS", "ot", 2], ["AS_double_buffer", "ot", 0], ["WS_double_buffer", "ot", 0], ["auto_unroll_max_step", "ot", 0]]}, "result": [[0.00012442079407051283], 0, 1.5712213516235352, 1597238491.1144147], "version": 0.2, "tvm_version": "0.7.dev1"}
{"input": ["cuda", "conv2d_HWNCnc_tensorcore.cuda", [["TENSOR", [14, 14, 8, 1024], "int8"], ["TENSOR", [1, 1, 256, 1024], "int8"], [1, 1], [0, 0, 0, 0], [1, 1], "int32"], {}], "config": {"index": 6437154, "code_hash": null, "entity": [["block_row_warps", "ot", 1], ["block_col_warps", "ot", 2], ["warp_row_tiles", "ot", 16], ["warp_col_tiles", "ot", 4], ["chunk", "ot", 2], ["fuse_pack", "ot", 0], ["split_block_k", "ot", 1], ["vector_ws", "ot", 1], ["vector_as", "ot", 8], ["reorder_inner", "re", [1, 0]], ["compute_at_AS", "ot", 1], ["compute_at_WS", "ot", 0], ["AS_double_buffer", "ot", 1], ["WS_double_buffer", "ot", 1], ["auto_unroll_max_step", "ot", 0]]}, "result": [[6.2530021179402e-05], 0, 1.5623161792755127, 1597237370.8364513], "version": 0.2, "tvm_version": "0.7.dev1"}
{"input": ["cuda", "conv2d_HWNCnc_tensorcore.cuda", [["TENSOR", [30, 30, 8, 256], "int8"], ["TENSOR", [3, 3, 256, 256], "int8"], [2, 2], [0, 0, 0, 0], [1, 1], "int32"], {}], "config": {"index": 16417398, "code_hash": null, "entity": [["block_row_warps", "ot", 1], ["block_col_warps", "ot", 2], ["warp_row_tiles", "ot", 1], ["warp_col_tiles", "ot", 2], ["chunk", "ot", 4], ["fuse_pack", "ot", 1], ["split_block_k", "ot", 1], ["vector_ws", "ot", 1], ["vector_as", "ot", 8], ["reorder_inner", "re", [1, 0]], ["compute_at_AS", "ot", 2], ["compute_at_WS", "ot", 3], ["AS_double_buffer", "ot", 1], ["WS_double_buffer", "ot", 1], ["auto_unroll_max_step", "ot", 512]]}, "result": [[0.00015312326750972763], 0, 2.566988945007324, 1597235253.8515537], "version": 0.2, "tvm_version": "0.7.dev1"}
{"input": ["cuda", "conv2d_HWNCnc_tensorcore.cuda", [["TENSOR", [28, 28, 8, 512], "int8"], ["TENSOR", [1, 1, 256, 512], "int8"], [1, 1], [0, 0, 0, 0], [1, 1], "int32"], {}], "config": {"index": 18107781, "code_hash": null, "entity": [["block_row_warps", "ot", 1], ["block_col_warps", "ot", 4], ["warp_row_tiles", "ot", 1], ["warp_col_tiles", "ot", 1], ["chunk", "ot", 8], ["fuse_pack", "ot", 1], ["split_block_k", "ot", 8], ["vector_ws", "ot", 1], ["vector_as", "ot", 8], ["reorder_inner", "re", [1, 0]], ["compute_at_AS", "ot", 3], ["compute_at_WS", "ot", 2], ["AS_double_buffer", "ot", 0], ["WS_double_buffer", "ot", 0], ["auto_unroll_max_step", "ot", 1500]]}, "result": [[0.0001291390576642336], 0, 3.025306463241577, 1597233612.5677142], "version": 0.2, "tvm_version": "0.7.dev1"}
{"input": ["cuda", "conv2d_HWNCnc_tensorcore.cuda", [["TENSOR", [28, 28, 8, 128], "int8"], ["TENSOR", [1, 1, 512, 128], "int8"], [1, 1], [0, 0, 0, 0], [1, 1], "int32"], {}], "config": {"index": 22213674, "code_hash": null, "entity": [["block_row_warps", "ot", 1], ["block_col_warps", "ot", 1], ["warp_row_tiles", "ot", 2], ["warp_col_tiles", "ot", 4], ["chunk", "ot", 8], ["fuse_pack", "ot", 1], ["split_block_k", "ot", 16], ["vector_ws", "ot", 1], ["vector_as", "ot", 16], ["reorder_inner", "re", [0, 1]], ["compute_at_AS", "ot", 3], ["compute_at_WS", "ot", 2], ["AS_double_buffer", "ot", 0], ["WS_double_buffer", "ot", 1], ["auto_unroll_max_step", "ot", 1500]]}, "result": [[8.574680596175478e-05], 0, 1.7382524013519287, 1597231699.6589992], "version": 0.2, "tvm_version": "0.7.dev1"}
{"input": ["cuda", "conv2d_HWNCnc_tensorcore.cuda", [["TENSOR", [30, 30, 8, 128], "int8"], ["TENSOR", [3, 3, 128, 128], "int8"], [1, 1], [0, 0, 0, 0], [1, 1], "int32"], {}], "config": {"index": 12162330, "code_hash": null, "entity": [["block_row_warps", "ot", 1], ["block_col_warps", "ot", 1], ["warp_row_tiles", "ot", 1], ["warp_col_tiles", "ot", 16], ["chunk", "ot", 4], ["fuse_pack", "ot", 1], ["split_block_k", "ot", 1], ["vector_ws", "ot", 1], ["vector_as", "ot", 16], ["reorder_inner", "re", [1, 0]], ["compute_at_AS", "ot", 1], ["compute_at_WS", "ot", 3], ["AS_double_buffer", "ot", 1], ["WS_double_buffer", "ot", 0], ["auto_unroll_max_step", "ot", 512]]}, "result": [[0.0001343099319286872], 0, 2.8167757987976074, 1597230901.2394376], "version": 0.2, "tvm_version": "0.7.dev1"}
{"input": ["cuda", "conv2d_HWNCnc_tensorcore.cuda", [["TENSOR", [58, 58, 8, 128], "int8"], ["TENSOR", [3, 3, 128, 128], "int8"], [2, 2], [0, 0, 0, 0], [1, 1], "int32"], {}], "config": {"index": 4947444, "code_hash": null, "entity": [["block_row_warps", "ot", 1], ["block_col_warps", "ot", 1], ["warp_row_tiles", "ot", 2], ["warp_col_tiles", "ot", 8], ["chunk", "ot", 1], ["fuse_pack", "ot", 1], ["split_block_k", "ot", 1], ["vector_ws", "ot", 1], ["vector_as", "ot", 8], ["reorder_inner", "re", [0, 1]], ["compute_at_AS", "ot", 2], ["compute_at_WS", "ot", 1], ["AS_double_buffer", "ot", 0], ["WS_double_buffer", "ot", 1], ["auto_unroll_max_step", "ot", 0]]}, "result": [[0.00016550361578400832], 0, 1.6581640243530273, 1597227651.8154116], "version": 0.2, "tvm_version": "0.7.dev1"}
{"input": ["cuda", "conv2d_HWNCnc_tensorcore.cuda", [["TENSOR", [56, 56, 8, 256], "int8"], ["TENSOR", [1, 1, 128, 256], "int8"], [1, 1], [0, 0, 0, 0], [1, 1], "int32"], {}], "config": {"index": 5918940, "code_hash": null, "entity": [["block_row_warps", "ot", 1], ["block_col_warps", "ot", 1], ["warp_row_tiles", "ot", 1], ["warp_col_tiles", "ot", 4], ["chunk", "ot", 4], ["fuse_pack", "ot", 0], ["split_block_k", "ot", 1], ["vector_ws", "ot", 1], ["vector_as", "ot", 8], ["reorder_inner", "re", [1, 0]], ["compute_at_AS", "ot", 1], ["compute_at_WS", "ot", 3], ["AS_double_buffer", "ot", 0], ["WS_double_buffer", "ot", 1], ["auto_unroll_max_step", "ot", 0]]}, "result": [[0.00018390364692482918], 0, 1.9767248630523682, 1597225903.09978], "version": 0.2, "tvm_version": "0.7.dev1"}
{"input": ["cuda", "conv2d_HWNCnc_tensorcore.cuda", [["TENSOR", [56, 56, 8, 256], "int8"], ["TENSOR", [1, 1, 64, 256], "int8"], [1, 1], [0, 0, 0, 0], [1, 1], "int32"], {}], "config": {"index": 9834282, "code_hash": null, "entity": [["block_row_warps", "ot", 1], ["block_col_warps", "ot", 1], ["warp_row_tiles", "ot", 8], ["warp_col_tiles", "ot", 16], ["chunk", "ot", 8], ["fuse_pack", "ot", 0], ["split_block_k", "ot", 8], ["vector_ws", "ot", 1], ["vector_as", "ot", 16], ["reorder_inner", "re", [1, 0]], ["compute_at_AS", "ot", 3], ["compute_at_WS", "ot", 2], ["AS_double_buffer", "ot", 0], ["WS_double_buffer", "ot", 0], ["auto_unroll_max_step", "ot", 512]]}, "result": [[0.00011052280120886501], 0, 1.8174631595611572, 1597222007.4201076], "version": 0.2, "tvm_version": "0.7.dev1"}
{"input": ["cuda", "conv2d_HWNCnc_tensorcore.cuda", [["TENSOR", [28, 28, 8, 512], "int8"], ["TENSOR", [1, 1, 1024, 512], "int8"], [2, 2], [0, 0, 0, 0], [1, 1], "int32"], {}], "config": {"index": 24343335, "code_hash": null, "entity": [["block_row_warps", "ot", 1], ["block_col_warps", "ot", 1], ["warp_row_tiles", "ot", 1], ["warp_col_tiles", "ot", 8], ["chunk", "ot", 1], ["fuse_pack", "ot", 0], ["split_block_k", "ot", 1], ["vector_ws", "ot", 1], ["vector_as", "ot", 16], ["reorder_inner", "re", [1, 0]], ["compute_at_AS", "ot", 3], ["compute_at_WS", "ot", 2], ["AS_double_buffer", "ot", 1], ["WS_double_buffer", "ot", 1], ["auto_unroll_max_step", "ot", 1500]]}, "result": [[0.00014173525587703436], 0, 2.693246603012085, 1597215485.759488], "version": 0.2, "tvm_version": "0.7.dev1"}
{"input": ["cuda", "conv2d_HWNCnc_tensorcore.cuda", [["TENSOR", [14, 14, 8, 1024], "int8"], ["TENSOR", [1, 1, 2048, 1024], "int8"], [2, 2], [0, 0, 0, 0], [1, 1], "int32"], {}], "config": {"index": 11233215, "code_hash": null, "entity": [["block_row_warps", "ot", 1], ["block_col_warps", "ot", 1], ["warp_row_tiles", "ot", 1], ["warp_col_tiles", "ot", 4], ["chunk", "ot", 2], ["fuse_pack", "ot", 1], ["split_block_k", "ot", 1], ["vector_ws", "ot", 1], ["vector_as", "ot", 8], ["reorder_inner", "re", [1, 0]], ["compute_at_AS", "ot", 2], ["compute_at_WS", "ot", 1], ["AS_double_buffer", "ot", 1], ["WS_double_buffer", "ot", 0], ["auto_unroll_max_step", "ot", 512]]}, "result": [[0.0001484949963269054], 0, 1.5747714042663574, 1597214339.86488], "version": 0.2, "tvm_version": "0.7.dev1"}
{"input": ["cuda", "conv2d_HWNCnc_tensorcore.cuda", [["TENSOR", [14, 14, 8, 1024], "int8"], ["TENSOR", [1, 1, 512, 1024], "int8"], [2, 2], [0, 0, 0, 0], [1, 1], "int32"], {}], "config": {"index": 17604318, "code_hash": null, "entity": [["block_row_warps", "ot", 1], ["block_col_warps", "ot", 2], ["warp_row_tiles", "ot", 1], ["warp_col_tiles", "ot", 4], ["chunk", "ot", 2], ["fuse_pack", "ot", 0], ["split_block_k", "ot", 1], ["vector_ws", "ot", 1], ["vector_as", "ot", 16], ["reorder_inner", "re", [1, 0]], ["compute_at_AS", "ot", 3], ["compute_at_WS", "ot", 1], ["AS_double_buffer", "ot", 0], ["WS_double_buffer", "ot", 0], ["auto_unroll_max_step", "ot", 1500]]}, "result": [[3.6148399880275363e-05], 0, 2.8455939292907715, 1597152068.6020324], "version": 0.2, "tvm_version": "0.7.dev1"}
{"input": ["cuda", "conv2d_HWNCnc_tensorcore.cuda", [["TENSOR", [28, 28, 8, 512], "int8"], ["TENSOR", [1, 1, 256, 512], "int8"], [2, 2], [0, 0, 0, 0], [1, 1], "int32"], {}], "config": {"index": 2311527, "code_hash": null, "entity": [["block_row_warps", "ot", 1], ["block_col_warps", "ot", 2], ["warp_row_tiles", "ot", 2], ["warp_col_tiles", "ot", 4], ["chunk", "ot", 2], ["fuse_pack", "ot", 0], ["split_block_k", "ot", 1], ["vector_ws", "ot", 1], ["vector_as", "ot", 16], ["reorder_inner", "re", [1, 0]], ["compute_at_AS", "ot", 1], ["compute_at_WS", "ot", 0], ["AS_double_buffer", "ot", 1], ["WS_double_buffer", "ot", 0], ["auto_unroll_max_step", "ot", 0]]}, "result": [[3.399951169888098e-05], 0, 2.181135416030884, 1597146174.4022374], "version": 0.2, "tvm_version": "0.7.dev1"}
{"input": ["cuda", "conv2d_HWNCnc_tensorcore.cuda", [["TENSOR", [28, 28, 8, 512], "int8"], ["TENSOR", [1, 1, 128, 512], "int8"], [1, 1], [0, 0, 0, 0], [1, 1], "int32"], {}], "config": {"index": 994176, "code_hash": null, "entity": [["block_row_warps", "ot", 1], ["block_col_warps", "ot", 1], ["warp_row_tiles", "ot", 16], ["warp_col_tiles", "ot", 4], ["chunk", "ot", 4], ["fuse_pack", "ot", 0], ["split_block_k", "ot", 1], ["vector_ws", "ot", 1], ["vector_as", "ot", 8], ["reorder_inner", "re", [1, 0]], ["compute_at_AS", "ot", 3], ["compute_at_WS", "ot", 1], ["AS_double_buffer", "ot", 0], ["WS_double_buffer", "ot", 0], ["auto_unroll_max_step", "ot", 0]]}, "result": [[8.833080411193604e-05], 0, 1.6177446842193604, 1597141337.1716504], "version": 0.2, "tvm_version": "0.7.dev1"}
{"input": ["cuda", "conv2d_HWNCnc_tensorcore.cuda", [["TENSOR", [56, 56, 8, 256], "int8"], ["TENSOR", [1, 1, 128, 256], "int8"], [2, 2], [0, 0, 0, 0], [1, 1], "int32"], {}], "config": {"index": 12426132, "code_hash": null, "entity": [["block_row_warps", "ot", 1], ["block_col_warps", "ot", 2], ["warp_row_tiles", "ot", 2], ["warp_col_tiles", "ot", 2], ["chunk", "ot", 8], ["fuse_pack", "ot", 0], ["split_block_k", "ot", 8], ["vector_ws", "ot", 1], ["vector_as", "ot", 16], ["reorder_inner", "re", [1, 0]], ["compute_at_AS", "ot", 3], ["compute_at_WS", "ot", 3], ["AS_double_buffer", "ot", 1], ["WS_double_buffer", "ot", 0], ["auto_unroll_max_step", "ot", 512]]}, "result": [[4.2892252192982455e-05], 0, 1.7953407764434814, 1597139352.6285117], "version": 0.2, "tvm_version": "0.7.dev1"}
{"input": ["cuda", "conv2d_HWNCnc_tensorcore.cuda", [["TENSOR", [56, 56, 8, 64], "int8"], ["TENSOR", [1, 1, 256, 64], "int8"], [1, 1], [0, 0, 0, 0], [1, 1], "int32"], {}], "config": {"index": 8748801, "code_hash": null, "entity": [["block_row_warps", "ot", 1], ["block_col_warps", "ot", 1], ["warp_row_tiles", "ot", 16], ["warp_col_tiles", "ot", 4], ["chunk", "ot", 8], ["fuse_pack", "ot", 0], ["split_block_k", "ot", 1], ["vector_ws", "ot", 1], ["vector_as", "ot", 1], ["reorder_inner", "re", [1, 0]], ["compute_at_AS", "ot", 3], ["compute_at_WS", "ot", 0], ["AS_double_buffer", "ot", 0], ["WS_double_buffer", "ot", 0], ["auto_unroll_max_step", "ot", 512]]}, "result": [[0.00012076917245061399], 0, 1.9663629531860352, 1597137496.1759672], "version": 0.2, "tvm_version": "0.7.dev1"}
{"input": ["cuda", "conv2d_HWNCnc_tensorcore.cuda", [["TENSOR", [58, 58, 8, 64], "int8"], ["TENSOR", [3, 3, 64, 64], "int8"], [1, 1], [0, 0, 0, 0], [1, 1], "int32"], {}], "config": {"index": 17090571, "code_hash": null, "entity": [["block_row_warps", "ot", 1], ["block_col_warps", "ot", 2], ["warp_row_tiles", "ot", 4], ["warp_col_tiles", "ot", 1], ["chunk", "ot", 4], ["fuse_pack", "ot", 1], ["split_block_k", "ot", 4], ["vector_ws", "ot", 1], ["vector_as", "ot", 16], ["reorder_inner", "re", [1, 0]], ["compute_at_AS", "ot", 3], ["compute_at_WS", "ot", 0], ["AS_double_buffer", "ot", 0], ["WS_double_buffer", "ot", 0], ["auto_unroll_max_step", "ot", 1500]]}, "result": [[0.00014013345970394738], 0, 2.452085256576538, 1597136812.9251256], "version": 0.2, "tvm_version": "0.7.dev1"}
{"input": ["cuda", "conv2d_HWNCnc_tensorcore.cuda", [["TENSOR", [56, 56, 8, 64], "int8"], ["TENSOR", [1, 1, 64, 64], "int8"], [1, 1], [0, 0, 0, 0], [1, 1], "int32"], {}], "config": {"index": 9677628, "code_hash": null, "entity": [["block_row_warps", "ot", 1], ["block_col_warps", "ot", 1], ["warp_row_tiles", "ot", 4], ["warp_col_tiles", "ot", 8], ["chunk", "ot", 8], ["fuse_pack", "ot", 0], ["split_block_k", "ot", 1], ["vector_ws", "ot", 1], ["vector_as", "ot", 8], ["reorder_inner", "re", [1, 0]], ["compute_at_AS", "ot", 2], ["compute_at_WS", "ot", 2], ["AS_double_buffer", "ot", 0], ["WS_double_buffer", "ot", 0], ["auto_unroll_max_step", "ot", 512]]}, "result": [[3.8156131745502994e-05], 0, 1.8471040725708008, 1597133393.871976], "version": 0.2, "tvm_version": "0.7.dev1"}
{"input": ["cuda", "conv2d_HWNCnc_tensorcore.cuda", [["TENSOR", [56, 56, 8, 256], "int8"], ["TENSOR", [1, 1, 512, 256], "int8"], [2, 2], [0, 0, 0, 0], [1, 1], "int32"], {}], "config": {"index": 15532728, "code_hash": null, "entity": [["block_row_warps", "ot", 1], ["block_col_warps", "ot", 4], ["warp_row_tiles", "ot", 8], ["warp_col_tiles", "ot", 2], ["chunk", "ot", 4], ["fuse_pack", "ot", 0], ["split_block_k", "ot", 2], ["vector_ws", "ot", 1], ["vector_as", "ot", 16], ["reorder_inner", "re", [1, 0]], ["compute_at_AS", "ot", 3], ["compute_at_WS", "ot", 1], ["AS_double_buffer", "ot", 1], ["WS_double_buffer", "ot", 1], ["auto_unroll_max_step", "ot", 512]]}, "result": [[0.00014518590061565523], 0, 1.8834314346313477, 1597130390.9561367], "version": 0.2, "tvm_version": "0.7.dev1"}
