tvm_benchmark/mixed_precision_models/tuning_logs/resnet18_HWNC_mixed_batch_8.log
{"input": ["cuda", "dense_int8.cuda", [["TENSOR", [8, 512], "int8"], ["TENSOR", [1000, 512], "int8"], null, "int32"], {}], "config": {"index": 121574, "code_hash": null, "entity": [["tile_y", "sp", [-1, 2, 2, 2]], ["tile_x", "sp", [-1, 1, 50, 1]], ["tile_k", "sp", [-1, 8]], ["auto_unroll_max_step", "ot", 1500]]}, "result": [[4.376039242191913e-06], 0, 1.8911986351013184, 1601193313.6967402], "version": 0.2, "tvm_version": "0.7.dev1"}
{"input": ["cuda", "conv2d_HWNCnc_tensorcore.cuda", [["TENSOR", [9, 9, 8, 512], "uint4"], ["TENSOR", [3, 3, 512, 512], "int4"], [1, 1], [0, 0, 0, 0], [1, 1], "int32"], {}], "config": {"index": 10488504, "code_hash": null, "entity": [["block_row_warps", "ot", 1], ["block_col_warps", "ot", 2], ["warp_row_tiles", "ot", 16], ["warp_col_tiles", "ot", 4], ["chunk", "ot", 8], ["fuse_pack", "ot", 1], ["split_block_k", "ot", 2], ["vector_ws", "ot", 1], ["vector_as", "ot", 8], ["reorder_inner", "re", [1, 0]], ["compute_at_AS", "ot", 1], ["compute_at_WS", "ot", 0], ["AS_double_buffer", "ot", 0], ["WS_double_buffer", "ot", 1], ["auto_unroll_max_step", "ot", 1500]]}, "result": [[8.312616852737905e-05], 0, 6.100672960281372, 1601190029.764832], "version": 0.2, "tvm_version": "0.7.dev1"}
{"input": ["cuda", "conv2d_HWNCnc_tensorcore.cuda", [["TENSOR", [16, 16, 8, 256], "uint4"], ["TENSOR", [3, 3, 512, 256], "int4"], [2, 2], [0, 0, 0, 0], [1, 1], "int32"], {}], "config": {"index": 10271637, "code_hash": null, "entity": [["block_row_warps", "ot", 1], ["block_col_warps", "ot", 1], ["warp_row_tiles", "ot", 8], ["warp_col_tiles", "ot", 8], ["chunk", "ot", 8], ["fuse_pack", "ot", 0], ["split_block_k", "ot", 2], ["vector_ws", "ot", 1], ["vector_as", "ot", 1], ["reorder_inner", "re", [1, 0]], ["compute_at_AS", "ot", 2], ["compute_at_WS", "ot", 3], ["AS_double_buffer", "ot", 1], ["WS_double_buffer", "ot", 0], ["auto_unroll_max_step", "ot", 1500]]}, "result": [[4.5499563409563414e-05], 0, 9.065518856048584, 1601185676.7905824], "version": 0.2, "tvm_version": "0.7.dev1"}
{"input": ["cuda", "conv2d_HWNCnc_tensorcore.cuda", [["TENSOR", [16, 16, 8, 256], "uint4"], ["TENSOR", [3, 3, 256, 256], "int4"], [1, 1], [0, 0, 0, 0], [1, 1], "int32"], {}], "config": {"index": 9170472, "code_hash": null, "entity": [["block_row_warps", "ot", 1], ["block_col_warps", "ot", 2], ["warp_row_tiles", "ot", 2], ["warp_col_tiles", "ot", 8], ["chunk", "ot", 2], ["fuse_pack", "ot", 1], ["split_block_k", "ot", 2], ["vector_ws", "ot", 1], ["vector_as", "ot", 1], ["reorder_inner", "re", [1, 0]], ["compute_at_AS", "ot", 1], ["compute_at_WS", "ot", 3], ["AS_double_buffer", "ot", 0], ["WS_double_buffer", "ot", 0], ["auto_unroll_max_step", "ot", 1500]]}, "result": [[7.626258686131387e-05], 0, 5.408949375152588, 1601183418.199325], "version": 0.2, "tvm_version": "0.7.dev1"}
{"input": ["cuda", "conv2d_HWNCnc_tensorcore.cuda", [["TENSOR", [30, 30, 8, 128], "uint4"], ["TENSOR", [3, 3, 256, 128], "int4"], [2, 2], [0, 0, 0, 0], [1, 1], "int32"], {}], "config": {"index": 9699198, "code_hash": null, "entity": [["block_row_warps", "ot", 1], ["block_col_warps", "ot", 4], ["warp_row_tiles", "ot", 8], ["warp_col_tiles", "ot", 4], ["chunk", "ot", 8], ["fuse_pack", "ot", 0], ["split_block_k", "ot", 2], ["vector_ws", "ot", 1], ["vector_as", "ot", 4], ["reorder_inner", "re", [1, 0]], ["compute_at_AS", "ot", 1], ["compute_at_WS", "ot", 1], ["AS_double_buffer", "ot", 1], ["WS_double_buffer", "ot", 0], ["auto_unroll_max_step", "ot", 1500]]}, "result": [[3.359186665211698e-05], 0, 2.119323492050171, 1601178440.7532935], "version": 0.2, "tvm_version": "0.7.dev1"}
{"input": ["cuda", "conv2d_HWNCnc_tensorcore.cuda", [["TENSOR", [30, 30, 8, 128], "uint4"], ["TENSOR", [3, 3, 128, 128], "int4"], [1, 1], [0, 0, 0, 0], [1, 1], "int32"], {}], "config": {"index": 12022755, "code_hash": null, "entity": [["block_row_warps", "ot", 1], ["block_col_warps", "ot", 4], ["warp_row_tiles", "ot", 2], ["warp_col_tiles", "ot", 4], ["chunk", "ot", 4], ["fuse_pack", "ot", 0], ["split_block_k", "ot", 4], ["vector_ws", "ot", 1], ["vector_as", "ot", 1], ["reorder_inner", "re", [1, 0]], ["compute_at_AS", "ot", 1], ["compute_at_WS", "ot", 2], ["AS_double_buffer", "ot", 1], ["WS_double_buffer", "ot", 1], ["auto_unroll_max_step", "ot", 1500]]}, "result": [[6.354763595413596e-05], 0, 5.089653015136719, 1601175633.8223944], "version": 0.2, "tvm_version": "0.7.dev1"}
{"input": ["cuda", "conv2d_HWNCnc_tensorcore.cuda", [["TENSOR", [58, 58, 8, 64], "uint4"], ["TENSOR", [3, 3, 128, 64], "int4"], [2, 2], [0, 0, 0, 0], [1, 1], "int32"], {}], "config": {"index": 11518788, "code_hash": null, "entity": [["block_row_warps", "ot", 1], ["block_col_warps", "ot", 2], ["warp_row_tiles", "ot", 1], ["warp_col_tiles", "ot", 8], ["chunk", "ot", 4], ["fuse_pack", "ot", 0], ["split_block_k", "ot", 2], ["vector_ws", "ot", 8], ["vector_as", "ot", 4], ["reorder_inner", "re", [1, 0]], ["compute_at_AS", "ot", 1], ["compute_at_WS", "ot", 0], ["AS_double_buffer", "ot", 1], ["WS_double_buffer", "ot", 1], ["auto_unroll_max_step", "ot", 1500]]}, "result": [[3.368390448184953e-05], 0, 1.9391844272613525, 1601171517.5133421], "version": 0.2, "tvm_version": "0.7.dev1"}
{"input": ["cuda", "conv2d_HWNCnc_tensorcore.cuda", [["TENSOR", [58, 58, 8, 64], "uint4"], ["TENSOR", [3, 3, 64, 64], "int4"], [1, 1], [0, 0, 0, 0], [1, 1], "int32"], {}], "config": {"index": 9690282, "code_hash": null, "entity": [["block_row_warps", "ot", 1], ["block_col_warps", "ot", 1], ["warp_row_tiles", "ot", 8], ["warp_col_tiles", "ot", 16], ["chunk", "ot", 8], ["fuse_pack", "ot", 0], ["split_block_k", "ot", 4], ["vector_ws", "ot", 1], ["vector_as", "ot", 1], ["reorder_inner", "re", [1, 0]], ["compute_at_AS", "ot", 1], ["compute_at_WS", "ot", 1], ["AS_double_buffer", "ot", 1], ["WS_double_buffer", "ot", 0], ["auto_unroll_max_step", "ot", 1500]]}, "result": [[6.243770648078372e-05], 0, 2.140929698944092, 1601169134.133529], "version": 0.2, "tvm_version": "0.7.dev1"}
{"input": ["cuda", "conv2d_nhwc_tensorcore_im2col.cuda", [["TENSOR", [8, 230, 230, 3], "int8"], ["TENSOR", [7, 7, 64, 3], "int8"], [2, 2], [0, 0, 0, 0], [1, 1], "NHWC", "int32"], {}], "config": {"index": 12630, "code_hash": null, "entity": [["block_row_warps", "ot", 4], ["block_col_warps", "ot", 2], ["warp_row_tiles", "ot", 2], ["warp_col_tiles", "ot", 2], ["chunk", "ot", 16], ["vector_width", "ot", 16], ["fuse_im2col", "ot", 1]]}, "result": [[0.00037691704444444443], 0, 1.4785218238830566, 1601166428.657415], "version": 0.2, "tvm_version": "0.7.dev1"}
{"input": ["cuda", "conv2d_HWNCnc_tensorcore.cuda", [["TENSOR", [56, 56, 8, 64], "uint4"], ["TENSOR", [1, 1, 128, 64], "int4"], [2, 2], [0, 0, 0, 0], [1, 1], "int32"], {}], "config": {"index": 373257, "code_hash": null, "entity": [["block_row_warps", "ot", 1], ["block_col_warps", "ot", 1], ["warp_row_tiles", "ot", 8], ["warp_col_tiles", "ot", 16], ["chunk", "ot", 4], ["fuse_pack", "ot", 0], ["split_block_k", "ot", 2], ["vector_ws", "ot", 8], ["vector_as", "ot", 4], ["reorder_inner", "re", [1, 0]], ["compute_at_AS", "ot", 1], ["compute_at_WS", "ot", 1], ["AS_double_buffer", "ot", 0], ["WS_double_buffer", "ot", 0], ["auto_unroll_max_step", "ot", 0]]}, "result": [[9.005863139834143e-06], 0, 1.4616127014160156, 1601165409.2448006], "version": 0.2, "tvm_version": "0.7.dev1"}
{"input": ["cuda", "conv2d_HWNCnc_tensorcore.cuda", [["TENSOR", [28, 28, 8, 128], "uint4"], ["TENSOR", [1, 1, 256, 128], "int4"], [2, 2], [0, 0, 0, 0], [1, 1], "int32"], {}], "config": {"index": 5022819, "code_hash": null, "entity": [["block_row_warps", "ot", 1], ["block_col_warps", "ot", 1], ["warp_row_tiles", "ot", 2], ["warp_col_tiles", "ot", 8], ["chunk", "ot", 8], ["fuse_pack", "ot", 0], ["split_block_k", "ot", 2], ["vector_ws", "ot", 1], ["vector_as", "ot", 1], ["reorder_inner", "re", [1, 0]], ["compute_at_AS", "ot", 1], ["compute_at_WS", "ot", 3], ["AS_double_buffer", "ot", 0], ["WS_double_buffer", "ot", 0], ["auto_unroll_max_step", "ot", 512]]}, "result": [[6.371171507436246e-06], 0, 1.4922785758972168, 1601163252.0905447], "version": 0.2, "tvm_version": "0.7.dev1"}
{"input": ["cuda", "conv2d_HWNCnc_tensorcore.cuda", [["TENSOR", [14, 14, 8, 256], "uint4"], ["TENSOR", [1, 1, 512, 256], "int4"], [2, 2], [0, 0, 0, 0], [1, 1], "int32"], {}], "config": {"index": 9758628, "code_hash": null, "entity": [["block_row_warps", "ot", 1], ["block_col_warps", "ot", 1], ["warp_row_tiles", "ot", 4], ["warp_col_tiles", "ot", 8], ["chunk", "ot", 8], ["fuse_pack", "ot", 0], ["split_block_k", "ot", 2], ["vector_ws", "ot", 8], ["vector_as", "ot", 1], ["reorder_inner", "re", [1, 0]], ["compute_at_AS", "ot", 2], ["compute_at_WS", "ot", 1], ["AS_double_buffer", "ot", 1], ["WS_double_buffer", "ot", 0], ["auto_unroll_max_step", "ot", 1500]]}, "result": [[6.410421613653115e-06], 0, 1.9329938888549805, 1601153699.7069225], "version": 0.2, "tvm_version": "0.7.dev1"}
{"input": ["cuda", "conv2d_HWNCnc_tensorcore.cuda", [["TENSOR", [9, 9, 8, 512], "int8"], ["TENSOR", [3, 3, 512, 512], "int8"], [1, 1], [0, 0, 0, 0], [1, 1], "int32"], {}], "config": {"index": 5044953, "code_hash": null, "entity": [["block_row_warps", "ot", 1], ["block_col_warps", "ot", 2], ["warp_row_tiles", "ot", 1], ["warp_col_tiles", "ot", 1], ["chunk", "ot", 4], ["fuse_pack", "ot", 1], ["split_block_k", "ot", 2], ["vector_ws", "ot", 1], ["vector_as", "ot", 8], ["reorder_inner", "re", [1, 0]], ["compute_at_AS", "ot", 1], ["compute_at_WS", "ot", 3], ["AS_double_buffer", "ot", 0], ["WS_double_buffer", "ot", 0], ["auto_unroll_max_step", "ot", 512]]}, "result": [[0.0001456778132474701], 0, 3.723189115524292, 1601139114.0750716], "version": 0.2, "tvm_version": "0.7.dev1"}
{"input": ["cuda", "conv2d_HWNCnc_tensorcore.cuda", [["TENSOR", [16, 16, 8, 256], "int8"], ["TENSOR", [3, 3, 512, 256], "int8"], [2, 2], [0, 0, 0, 0], [1, 1], "int32"], {}], "config": {"index": 692820, "code_hash": null, "entity": [["block_row_warps", "ot", 1], ["block_col_warps", "ot", 1], ["warp_row_tiles", "ot", 1], ["warp_col_tiles", "ot", 2], ["chunk", "ot", 8], ["fuse_pack", "ot", 1], ["split_block_k", "ot", 2], ["vector_ws", "ot", 1], ["vector_as", "ot", 4], ["reorder_inner", "re", [1, 0]], ["compute_at_AS", "ot", 2], ["compute_at_WS", "ot", 2], ["AS_double_buffer", "ot", 0], ["WS_double_buffer", "ot", 0], ["auto_unroll_max_step", "ot", 0]]}, "result": [[7.552128691851389e-05], 0, 1.8542993068695068, 1601136881.2012298], "version": 0.2, "tvm_version": "0.7.dev1"}
{"input": ["cuda", "conv2d_HWNCnc_tensorcore.cuda", [["TENSOR", [16, 16, 8, 256], "int8"], ["TENSOR", [3, 3, 256, 256], "int8"], [1, 1], [0, 0, 0, 0], [1, 1], "int32"], {}], "config": {"index": 1740000, "code_hash": null, "entity": [["block_row_warps", "ot", 1], ["block_col_warps", "ot", 2], ["warp_row_tiles", "ot", 8], ["warp_col_tiles", "ot", 2], ["chunk", "ot", 2], ["fuse_pack", "ot", 1], ["split_block_k", "ot", 2], ["vector_ws", "ot", 1], ["vector_as", "ot", 8], ["reorder_inner", "re", [1, 0]], ["compute_at_AS", "ot", 2], ["compute_at_WS", "ot", 2], ["AS_double_buffer", "ot", 1], ["WS_double_buffer", "ot", 0], ["auto_unroll_max_step", "ot", 0]]}, "result": [[0.00012534316193656093], 0, 1.474370002746582, 1601131152.3324475], "version": 0.2, "tvm_version": "0.7.dev1"}
{"input": ["cuda", "conv2d_HWNCnc_tensorcore.cuda", [["TENSOR", [30, 30, 8, 128], "int8"], ["TENSOR", [3, 3, 256, 128], "int8"], [2, 2], [0, 0, 0, 0], [1, 1], "int32"], {}], "config": {"index": 2743848, "code_hash": null, "entity": [["block_row_warps", "ot", 1], ["block_col_warps", "ot", 1], ["warp_row_tiles", "ot", 4], ["warp_col_tiles", "ot", 16], ["chunk", "ot", 4], ["fuse_pack", "ot", 0], ["split_block_k", "ot", 2], ["vector_ws", "ot", 1], ["vector_as", "ot", 8], ["reorder_inner", "re", [0, 1]], ["compute_at_AS", "ot", 2], ["compute_at_WS", "ot", 2], ["AS_double_buffer", "ot", 0], ["WS_double_buffer", "ot", 1], ["auto_unroll_max_step", "ot", 0]]}, "result": [[6.520049459576308e-05], 0, 1.8035862445831299, 1601128478.5020196], "version": 0.2, "tvm_version": "0.7.dev1"}
{"input": ["cuda", "conv2d_HWNCnc_tensorcore.cuda", [["TENSOR", [30, 30, 8, 128], "int8"], ["TENSOR", [3, 3, 128, 128], "int8"], [1, 1], [0, 0, 0, 0], [1, 1], "int32"], {}], "config": {"index": 6504921, "code_hash": null, "entity": [["block_row_warps", "ot", 1], ["block_col_warps", "ot", 1], ["warp_row_tiles", "ot", 16], ["warp_col_tiles", "ot", 8], ["chunk", "ot", 4], ["fuse_pack", "ot", 1], ["split_block_k", "ot", 4], ["vector_ws", "ot", 1], ["vector_as", "ot", 8], ["reorder_inner", "re", [0, 1]], ["compute_at_AS", "ot", 0], ["compute_at_WS", "ot", 1], ["AS_double_buffer", "ot", 0], ["WS_double_buffer", "ot", 1], ["auto_unroll_max_step", "ot", 512]]}, "result": [[0.0001460079636711281], 0, 4.638911485671997, 1601124658.1495757], "version": 0.2, "tvm_version": "0.7.dev1"}
{"input": ["cuda", "conv2d_HWNCnc_tensorcore.cuda", [["TENSOR", [58, 58, 8, 64], "int8"], ["TENSOR", [3, 3, 128, 64], "int8"], [2, 2], [0, 0, 0, 0], [1, 1], "int32"], {}], "config": {"index": 1480125, "code_hash": null, "entity": [["block_row_warps", "ot", 1], ["block_col_warps", "ot", 2], ["warp_row_tiles", "ot", 8], ["warp_col_tiles", "ot", 2], ["chunk", "ot", 4], ["fuse_pack", "ot", 0], ["split_block_k", "ot", 2], ["vector_ws", "ot", 1], ["vector_as", "ot", 8], ["reorder_inner", "re", [1, 0]], ["compute_at_AS", "ot", 2], ["compute_at_WS", "ot", 1], ["AS_double_buffer", "ot", 1], ["WS_double_buffer", "ot", 0], ["auto_unroll_max_step", "ot", 0]]}, "result": [[7.049183282006158e-05], 0, 1.4197404384613037, 1601123252.519461], "version": 0.2, "tvm_version": "0.7.dev1"}
{"input": ["cuda", "conv2d_HWNCnc_tensorcore.cuda", [["TENSOR", [58, 58, 8, 64], "int8"], ["TENSOR", [3, 3, 64, 64], "int8"], [1, 1], [0, 0, 0, 0], [1, 1], "int32"], {}], "config": {"index": 4907289, "code_hash": null, "entity": [["block_row_warps", "ot", 1], ["block_col_warps", "ot", 2], ["warp_row_tiles", "ot", 16], ["warp_col_tiles", "ot", 1], ["chunk", "ot", 4], ["fuse_pack", "ot", 0], ["split_block_k", "ot", 8], ["vector_ws", "ot", 1], ["vector_as", "ot", 4], ["reorder_inner", "re", [1, 0]], ["compute_at_AS", "ot", 3], ["compute_at_WS", "ot", 2], ["AS_double_buffer", "ot", 0], ["WS_double_buffer", "ot", 0], ["auto_unroll_max_step", "ot", 512]]}, "result": [[0.00011880586349924586], 0, 1.5197060108184814, 1601120393.93331], "version": 0.2, "tvm_version": "0.7.dev1"}
{"input": ["cuda", "conv2d_HWNCnc_tensorcore.cuda", [["TENSOR", [56, 56, 8, 64], "int8"], ["TENSOR", [1, 1, 128, 64], "int8"], [2, 2], [0, 0, 0, 0], [1, 1], "int32"], {}], "config": {"index": 2961792, "code_hash": null, "entity": [["block_row_warps", "ot", 1], ["block_col_warps", "ot", 1], ["warp_row_tiles", "ot", 8], ["warp_col_tiles", "ot", 4], ["chunk", "ot", 8], ["fuse_pack", "ot", 0], ["split_block_k", "ot", 4], ["vector_ws", "ot", 1], ["vector_as", "ot", 4], ["reorder_inner", "re", [1, 0]], ["compute_at_AS", "ot", 1], ["compute_at_WS", "ot", 3], ["AS_double_buffer", "ot", 0], ["WS_double_buffer", "ot", 1], ["auto_unroll_max_step", "ot", 0]]}, "result": [[1.3805767380588136e-05], 0, 1.7856018543243408, 1601115130.7410197], "version": 0.2, "tvm_version": "0.7.dev1"}
{"input": ["cuda", "conv2d_HWNCnc_tensorcore.cuda", [["TENSOR", [28, 28, 8, 128], "int8"], ["TENSOR", [1, 1, 256, 128], "int8"], [2, 2], [0, 0, 0, 0], [1, 1], "int32"], {}], "config": {"index": 11288592, "code_hash": null, "entity": [["block_row_warps", "ot", 1], ["block_col_warps", "ot", 1], ["warp_row_tiles", "ot", 8], ["warp_col_tiles", "ot", 4], ["chunk", "ot", 8], ["fuse_pack", "ot", 0], ["split_block_k", "ot", 4], ["vector_ws", "ot", 1], ["vector_as", "ot", 4], ["reorder_inner", "re", [0, 1]], ["compute_at_AS", "ot", 2], ["compute_at_WS", "ot", 3], ["AS_double_buffer", "ot", 0], ["WS_double_buffer", "ot", 1], ["auto_unroll_max_step", "ot", 1500]]}, "result": [[1.0782271290158083e-05], 0, 1.8995814323425293, 1601112911.8760257], "version": 0.2, "tvm_version": "0.7.dev1"}
{"input": ["cuda", "conv2d_HWNCnc_tensorcore.cuda", [["TENSOR", [14, 14, 8, 256], "int8"], ["TENSOR", [1, 1, 512, 256], "int8"], [2, 2], [0, 0, 0, 0], [1, 1], "int32"], {}], "config": {"index": 10876131, "code_hash": null, "entity": [["block_row_warps", "ot", 1], ["block_col_warps", "ot", 1], ["warp_row_tiles", "ot", 16], ["warp_col_tiles", "ot", 2], ["chunk", "ot", 4], ["fuse_pack", "ot", 0], ["split_block_k", "ot", 2], ["vector_ws", "ot", 1], ["vector_as", "ot", 8], ["reorder_inner", "re", [1, 0]], ["compute_at_AS", "ot", 3], ["compute_at_WS", "ot", 1], ["AS_double_buffer", "ot", 0], ["WS_double_buffer", "ot", 1], ["auto_unroll_max_step", "ot", 1500]]}, "result": [[1.1134201232693988e-05], 0, 2.1460418701171875, 1601109608.768133], "version": 0.2, "tvm_version": "0.7.dev1"}
